{
  "dataset_id": "synthetic_dataset_v1",
  "candidate_id": "candidate_proj_default",
  "observable_ids": [
    "site_A_up",
    "site_A_down",
    "site_B_up",
    "site_B_down"
  ],
  "target_ids": [
    "site_A",
    "site_B"
  ],
  "observations": [
    {
      "task_id": "bare_site_A_m0p2",
      "target_id": "site_A",
      "alpha": -0.2,
      "mode": "BARE",
      "observable_id": "site_A_up",
      "value": 2.25,
      "unit": "electrons",
      "iteration": 0,
      "scf_valid": true,
      "magnetic_signature": "synthetic_collinear_reference",
      "source_locator": "synthetic://BARE/site_A/-0.2/site_A_up"
    },
    {
      "task_id": "bare_site_A_m0p2",
      "target_id": "site_A",
      "alpha": -0.2,
      "mode": "BARE",
      "observable_id": "site_A_down",
      "value": 2.3499999999999996,
      "unit": "electrons",
      "iteration": 0,
      "scf_valid": true,
      "magnetic_signature": "synthetic_collinear_reference",
      "source_locator": "synthetic://BARE/site_A/-0.2/site_A_down"
    },
    {
      "task_id": "bare_site_A_m0p2",
      "target_id": "site_A",
      "alpha": -0.2,
      "mode": "BARE",
      "observable_id": "site_B_up",
      "value": 2.105,
      "unit": "electrons",
      "iteration": 0,
      "scf_valid": true,
      "magnetic_signature": "synthetic_collinear_reference",
      "source_locator": "synthetic://BARE/site_A/-0.2/site_B_up"
    },
    {
      "task_id": "bare_site_A_m0p2",
      "target_id": "site_A",
      "alpha": -0.2,
      "mode": "BARE",
      "observable_id": "site_B_down",
      "value": 2.405,
      "unit": "electrons",
      "iteration": 0,
      "scf_valid": true,
      "magnetic_signature": "synthetic_collinear_reference",
      "source_locator": "synthetic://BARE/site_A/-0.2/site_B_down"
    },
    {
      "task_id": "bare_site_A_m0p1",
      "target_id": "site_A",
      "alpha": -0.1,
      "mode": "BARE",
      "observable_id": "site_A_up",
      "value": 2.225,
      "unit": "electrons",
      "iteration": 0,
      "scf_valid": true,
      "magnetic_signature": "synthetic_collinear_reference",
      "source_locator": "synthetic://BARE/site_A/-0.1/site_A_up"
    },
    {
      "task_id": "bare_site_A_m0p1",
      "target_id": "site_A",
      "alpha": -0.1,
      "mode": "BARE",
      "observable_id": "site_A_down",
      "value": 2.3249999999999997,
      "unit": "electrons",
      "iteration": 0,
      "scf_valid": true,
      "magnetic_signature": "synthetic_collinear_reference",
      "source_locator": "synthetic://BARE/site_A/-0.1/site_A_down"
    },
    {
      "task_id": "bare_site_A_m0p1",
      "target_id": "site_A",
      "alpha": -0.1,
      "mode": "BARE",
      "observable_id": "site_B_up",
      "value": 2.1025,
      "unit": "electrons",
      "iteration": 0,
      "scf_valid": true,
      "magnetic_signature": "synthetic_collinear_reference",
      "source_locator": "synthetic://BARE/site_A/-0.1/site_B_up"
    },
    {
      "task_id": "bare_site_A_m0p1",
      "target_id": "site_A",
      "alpha": -0.1,
      "mode": "BARE",
      "observable_id": "site_B_down",
      "value": 2.4025,
      "unit": "electrons",
      "iteration": 0,
      "scf_valid": true,
      "magnetic_signature": "synthetic_collinear_reference",
      "source_locator": "synthetic://BARE/site_A/-0.1/site_B_down"
    },
    {
      "task_id": "bare_site_A_0p0",
      "target_id": "site_A",
      "alpha": 0.0,
      "mode": "BARE",
      "observable_id": "site_A_up",
      "value": 2.2,
      "unit": "electrons",
      "iteration": 0,
      "scf_valid": true,
      "magnetic_signature": "synthetic_collinear_reference",
      "source_locator": "synthetic://BARE/site_A/0.0/site_A_up"
    },
    {
      "task_id": "bare_site_A_0p0",
      "target_id": "site_A",
      "alpha": 0.0,
      "mode": "BARE",
      "observable_id": "site_A_down",
      "value": 2.3,
      "unit": "electrons",
      "iteration": 0,
      "scf_valid": true,
      "magnetic_signature": "synthetic_collinear_reference",
      "source_locator": "synthetic://BARE/site_A/0.0/site_A_down"
    },
    {
      "task_id": "bare_site_A_0p0",
      "target_id": "site_A",
      "alpha": 0.0,
      "mode": "BARE",
      "observable_id": "site_B_up",
      "value": 2.1,
      "unit": "electrons",
      "iteration": 0,
      "scf_valid": true,
      "magnetic_signature": "synthetic_collinear_reference",
      "source_locator": "synthetic://BARE/site_A/0.0/site_B_up"
    },
    {
      "task_id": "bare_site_A_0p0",
      "target_id": "site_A",
      "alpha": 0.0,
      "mode": "BARE",
      "observable_id": "site_B_down",
      "value": 2.4,
      "unit": "electrons",
      "iteration": 0,
      "scf_valid": true,
      "magnetic_signature": "synthetic_collinear_reference",
      "source_locator": "synthetic://BARE/site_A/0.0/site_B_down"
    },
    {
      "task_id": "bare_site_A_0p1",
      "target_id": "site_A",
      "alpha": 0.1,
      "mode": "BARE",
      "observable_id": "site_A_up",
      "value": 2.1750000000000003,
      "unit": "electrons",
      "iteration": 0,
      "scf_valid": true,
      "magnetic_signature": "synthetic_collinear_reference",
      "source_locator": "synthetic://BARE/site_A/0.1/site_A_up"
    },
    {
      "task_id": "bare_site_A_0p1",
      "target_id": "site_A",
      "alpha": 0.1,
      "mode": "BARE",
      "observable_id": "site_A_down",
      "value": 2.275,
      "unit": "electrons",
      "iteration": 0,
      "scf_valid": true,
      "magnetic_signature": "synthetic_collinear_reference",
      "source_locator": "synthetic://BARE/site_A/0.1/site_A_down"
    },
    {
      "task_id": "bare_site_A_0p1",
      "target_id": "site_A",
      "alpha": 0.1,
      "mode": "BARE",
      "observable_id": "site_B_up",
      "value": 2.0975,
      "unit": "electrons",
      "iteration": 0,
      "scf_valid": true,
      "magnetic_signature": "synthetic_collinear_reference",
      "source_locator": "synthetic://BARE/site_A/0.1/site_B_up"
    },
    {
      "task_id": "bare_site_A_0p1",
      "target_id": "site_A",
      "alpha": 0.1,
      "mode": "BARE",
      "observable_id": "site_B_down",
      "value": 2.3975,
      "unit": "electrons",
      "iteration": 0,
      "scf_valid": true,
      "magnetic_signature": "synthetic_collinear_reference",
      "source_locator": "synthetic://BARE/site_A/0.1/site_B_down"
    },
    {
      "task_id": "bare_site_A_0p2",
      "target_id": "site_A",
      "alpha": 0.2,
      "mode": "BARE",
      "observable_id": "site_A_up",
      "value": 2.1500000000000004,
      "unit": "electrons",
      "iteration": 0,
      "scf_valid": true,
      "magnetic_signature": "synthetic_collinear_reference",
      "source_locator": "synthetic://BARE/site_A/0.2/site_A_up"
    },
    {
      "task_id": "bare_site_A_0p2",
      "target_id": "site_A",
      "alpha": 0.2,
      "mode": "BARE",
      "observable_id": "site_A_down",
      "value": 2.25,
      "unit": "electrons",
      "iteration": 0,
      "scf_valid": true,
      "magnetic_signature": "synthetic_collinear_reference",
      "source_locator": "synthetic://BARE/site_A/0.2/site_A_down"
    },
    {
      "task_id": "bare_site_A_0p2",
      "target_id": "site_A",
      "alpha": 0.2,
      "mode": "BARE",
      "observable_id": "site_B_up",
      "value": 2.095,
      "unit": "electrons",
      "iteration": 0,
      "scf_valid": true,
      "magnetic_signature": "synthetic_collinear_reference",
      "source_locator": "synthetic://BARE/site_A/0.2/site_B_up"
    },
    {
      "task_id": "bare_site_A_0p2",
      "target_id": "site_A",
      "alpha": 0.2,
      "mode": "BARE",
      "observable_id": "site_B_down",
      "value": 2.395,
      "unit": "electrons",
      "iteration": 0,
      "scf_valid": true,
      "magnetic_signature": "synthetic_collinear_reference",
      "source_locator": "synthetic://BARE/site_A/0.2/site_B_down"
    },
    {
      "task_id": "bare_site_B_m0p2",
      "target_id": "site_B",
      "alpha": -0.2,
      "mode": "BARE",
      "observable_id": "site_A_up",
      "value": 2.205,
      "unit": "electrons",
      "iteration": 0,
      "scf_valid": true,
      "magnetic_signature": "synthetic_collinear_reference",
      "source_locator": "synthetic://BARE/site_B/-0.2/site_A_up"
    },
    {
      "task_id": "bare_site_B_m0p2",
      "target_id": "site_B",
      "alpha": -0.2,
      "mode": "BARE",
      "observable_id": "site_A_down",
      "value": 2.3049999999999997,
      "unit": "electrons",
      "iteration": 0,
      "scf_valid": true,
      "magnetic_signature": "synthetic_collinear_reference",
      "source_locator": "synthetic://BARE/site_B/-0.2/site_A_down"
    },
    {
      "task_id": "bare_site_B_m0p2",
      "target_id": "site_B",
      "alpha": -0.2,
      "mode": "BARE",
      "observable_id": "site_B_up",
      "value": 2.145,
      "unit": "electrons",
      "iteration": 0,
      "scf_valid": true,
      "magnetic_signature": "synthetic_collinear_reference",
      "source_locator": "synthetic://BARE/site_B/-0.2/site_B_up"
    },
    {
      "task_id": "bare_site_B_m0p2",
      "target_id": "site_B",
      "alpha": -0.2,
      "mode": "BARE",
      "observable_id": "site_B_down",
      "value": 2.445,
      "unit": "electrons",
      "iteration": 0,
      "scf_valid": true,
      "magnetic_signature": "synthetic_collinear_reference",
      "source_locator": "synthetic://BARE/site_B/-0.2/site_B_down"
    },
    {
      "task_id": "bare_site_B_m0p1",
      "target_id": "site_B",
      "alpha": -0.1,
      "mode": "BARE",
      "observable_id": "site_A_up",
      "value": 2.2025,
      "unit": "electrons",
      "iteration": 0,
      "scf_valid": true,
      "magnetic_signature": "synthetic_collinear_reference",
      "source_locator": "synthetic://BARE/site_B/-0.1/site_A_up"
    },
    {
      "task_id": "bare_site_B_m0p1",
      "target_id": "site_B",
      "alpha": -0.1,
      "mode": "BARE",
      "observable_id": "site_A_down",